{
  "schemaVersion": "1.0.0",
  "packetId": "ccpa-strong-001",
  "packetVersion": "1.0.0",
  "packetPurpose": "fixture",
  "createdDate": "2026-04-20",
  "author": "EvidenceGate Phase 0 — synthetic benchmark packet",
  "notes": "SYNTHETIC BENCHMARK. Every record in this packet is invented to exercise the auditor's pass and partial paths. Nothing here is real market evidence and no conclusion drawn from it says anything about the actual product hypothesis. Deliberate imperfections are included (one referral-chain source, one leading question, one out-of-segment source, one loss log without buyer-stated reasons) so that a flawless-packet illusion is not created.",

  "product": {
    "name": "Commercial Cleaning Proposal Assistant",
    "statedTargetSegment": {
      "text": "United States commercial cleaning companies with 1–25 cleaning staff that sell recurring janitorial contracts, where the owner personally conducts facility walkthroughs and personally writes the proposal document.",
      "attributes": {
        "geography": "United States",
        "organizationSizeBound": "1–25 cleaning staff (headcount performing cleaning work, excluding office staff)",
        "businessModel": "Recurring janitorial contracts, bid or negotiated per facility",
        "roleOfBuyer": "Owner or owner-operator, who both walks the facility and writes the proposal",
        "serviceLine": "Commercial janitorial",
        "exclusions": [
          "Residential cleaning",
          "Franchise locations where proposals are produced by the franchisor",
          "Companies with a dedicated full-time sales or bid-writing role"
        ]
      }
    },
    "problemHypothesis": "Owners spend excessive time turning facility-walkthrough information into complete commercial-cleaning proposals."
  },

  "claims": [
    {
      "claimId": "CL-001",
      "requirementIds": ["REQ-1"],
      "claimText": "The target customer is a United States commercial cleaning company with 1–25 cleaning staff selling recurring janitorial contracts, in which the owner personally performs facility walkthroughs and personally produces the proposal document.",
      "claimScope": "definition",
      "definedThreshold": "A company is in segment only if all four boundaries hold: US-based, 1–25 cleaning staff, recurring janitorial contracts, owner personally produces the proposal.",
      "statedBy": "Product team"
    },
    {
      "claimId": "CL-002",
      "requirementIds": ["REQ-2"],
      "claimText": "Owners in the target segment manually assemble the proposal document from facility-walkthrough notes, and that assembly takes more than two hours of active work per proposal.",
      "claimScope": "instance",
      "definedThreshold": "More than 2 hours of active document-assembly work per proposal",
      "statedBy": "Product team"
    },
    {
      "claimId": "CL-003",
      "requirementIds": ["REQ-3"],
      "claimText": "For an individual owner in the target segment, proposal production recurs at a rate of at least one proposal per week, sustained across at least eight consecutive weeks.",
      "claimScope": "recurrence",
      "definedThreshold": "At least 1 proposal per week, sustained over at least 8 consecutive weeks, per owner",
      "statedBy": "Product team",
      "notes": "This claim is deliberately scoped to recurrence for an individual owner. It does not assert a rate across the segment."
    },
    {
      "claimId": "CL-004",
      "requirementIds": ["REQ-4"],
      "claimText": "Owners in the target segment lose or are excluded from at least one bid per quarter because the proposal reached the buyer after the buyer's stated decision date.",
      "claimScope": "narrow-pattern",
      "definedThreshold": "At least 1 bid per quarter lost or rendered ineligible, with lateness established by the buyer rather than inferred",
      "statedBy": "Product team"
    },
    {
      "claimId": "CL-005",
      "requirementIds": ["REQ-5"],
      "claimText": "Owners in the target segment have already committed a scarce resource to producing proposals — paying an outside person, allocating staff hours, or maintaining a purchased workaround — for at least three consecutive months.",
      "claimScope": "narrow-pattern",
      "definedThreshold": "Documented expenditure of money or allocated staff hours on proposal production, sustained at least 3 consecutive months",
      "statedBy": "Product team",
      "notes": "Scoped to the existing problem. Interest in the proposed product is explicitly out of scope."
    }
  ],

  "evidence": [
    {
      "evidenceId": "EV-001",
      "evidenceCategory": "business-artifact",
      "proximity": "generated-by-the-behavior",
      "origin": "synthetic",
      "synthetic": true,
      "collectedDate": "2026-01-19",
      "collectionMethod": "Export of the recruitment screening sheet used before any interview was scheduled.",
      "source": {
        "sourceType": "internal-document",
        "description": "Recruitment screening sheet listing every company contacted, the four segment boundaries, and the in/out decision recorded per company.",
        "sourceId": "INTERNAL-SCREEN",
        "independence": "team-internal",
        "relationshipToTeam": "employee"
      },
      "content": {
        "mode": "artifact-summary",
        "observation": "Sheet lists 12 companies contacted between 2026-01-06 and 2026-01-16. Each row records headcount, country, contract type, and who writes the proposal. Four companies admitted (P-01, P-02, P-03, P-04). Seven excluded with a boundary named per row: three for residential-only work, two for headcount above 25, one franchise where the franchisor produces proposals, one where a full-time estimator writes proposals. One company (P-05) recorded as 'out of segment — retained for contrast only, 60 staff'. No row is blank and no row records 'unsure'.",
        "measurements": [
          { "label": "Companies screened", "value": 12, "unit": "companies" },
          { "label": "Admitted to segment", "value": 4, "unit": "companies" },
          { "label": "Excluded with a named boundary", "value": 7, "unit": "companies" },
          { "label": "Rows recording an undecidable case", "value": 0, "unit": "companies" }
        ]
      },
      "scope": {
        "subjectCount": 12,
        "segmentFit": "in-segment",
        "segmentNotes": "The sheet is the record of the segment definition being applied; it covers both admitted and excluded companies.",
        "timeframeCovered": { "start": "2026-01-06", "end": "2026-01-16" },
        "recruitment": "not-applicable"
      },
      "declaredRelevance": ["REQ-1"],
      "limitations": [
        "Screening decisions were made by one person; no second rater applied the definition independently, so consistency across raters is untested.",
        "Companies were sourced from two regional trade association directories, which is not a sampling frame for the segment as a whole."
      ]
    },

    {
      "evidenceId": "EV-002",
      "evidenceCategory": "instrumented-record",
      "proximity": "generated-by-the-behavior",
      "origin": "synthetic",
      "synthetic": true,
      "collectedDate": "2026-03-16",
      "collectionMethod": "Owner exported document version history and editing-session metadata from their word processor for all proposals produced in the window.",
      "source": {
        "sourceType": "tool-export",
        "description": "Word processor version history for Meridian Facility Care, 8 cleaning staff, Texas.",
        "sourceId": "P-01",
        "independence": "independent",
        "relationshipToTeam": "none"
      },
      "content": {
        "mode": "measurement",
        "observation": "Version history covers 9 proposal documents created between 2026-01-20 and 2026-03-15. Each document shows an initial file created within 24 hours of a walkthrough calendar entry, followed by between 4 and 11 separate editing sessions. Active editing time is computed from session start and end stamps, excluding gaps longer than 15 minutes.",
        "measurements": [
          { "label": "Proposals covered", "value": 9, "unit": "proposals", "n": 9 },
          { "label": "Median active editing time per proposal", "value": 192, "unit": "minutes", "n": 9, "basis": "Sum of editing sessions per document, gaps over 15 minutes excluded" },
          { "label": "Shortest proposal", "value": 118, "unit": "minutes", "n": 1 },
          { "label": "Longest proposal", "value": 341, "unit": "minutes", "n": 1 },
          { "label": "Proposals exceeding 120 minutes active editing", "value": 8, "unit": "proposals", "n": 9 }
        ]
      },
      "scope": {
        "subjectCount": 1,
        "segmentFit": "in-segment",
        "segmentNotes": "8 cleaning staff, US, recurring janitorial contracts, owner writes proposals — all four boundaries met per EV-001.",
        "timeframeCovered": { "start": "2026-01-20", "end": "2026-03-15" },
        "recruitment": "sampled"
      },
      "declaredRelevance": ["REQ-2", "REQ-3"],
      "limitations": [
        "Active editing time excludes thinking, phone calls, and site measurement done outside the document, so it is a floor rather than total task time.",
        "One owner only; nothing here speaks to any other company.",
        "The 15-minute gap rule was chosen by the researcher and not validated against observed behavior."
      ]
    },

    {
      "evidenceId": "EV-003",
      "evidenceCategory": "direct-observation",
      "proximity": "observed-directly",
      "origin": "synthetic",
      "synthetic": true,
      "collectedDate": "2026-02-11",
      "collectionMethod": "Researcher sat with the owner for one complete walkthrough-to-proposal cycle, recording timestamps and steps without prompting or assisting.",
      "source": {
        "sourceType": "customer-participant",
        "description": "Owner of Sanchez Commercial Cleaning, 5 cleaning staff, Arizona.",